<?xml version="1.0" encoding="utf-8"?>
<KagaConfig xmlns:xsi="http://www.w3.org/2001/XMLSchema-instance" xsi:noNamespaceSchemaLocation="/Roboter/Config/System/Common/Schemes/KagaConfig.xsd">
  <Version Label="">
    <Info Version="KUKA V8.3" />
    <Schema Version="300" />
  </Version>
  <BusConfig isActive="false" Id="NETWORK_CONFIG_KUKA_OPTION_NETWORK_INTERFACE">
    <PhysicalNetworkDevice Priority="13" HibernateSupport="true" LinkSettings="Autonegotiation">
      <IfConfig Name="gei" Unit="1" IpConfigType="noIp" Ip="none" Netmask="none" />
      <VirtualNetworkDevice>
        <!--INBETRIEBNAHME-TODO:
			1) @isActive des Elements /KagaConfig/BusConfig auf "true" setzen (aktiviert diese Konfiguration)
			2) @IpConfigType auf "IpnetStatic" abaendern (Bei DHCP: "IpnetDhcp")
			3) In @Ip die gewuenschte IP-Adresse eintragen (Bei DHCP: @Ip und @Netmask so belassen)
			Bsp:
			<IfConfig Name="KONI" Unit="20" IpConfigType="IpnetStatic" Ip="160.160.x.x" Netmask="ffff0000"/>
			-->
        <IfConfig Name="KONI" Unit="20" IpConfigType="IpnetStatic" Ip="172.30.1.147" Netmask="ffff0000" />
        <Queue Priority="255" Resources="100">
          <Filter String="AcceptAll" />
        </Queue>
      </VirtualNetworkDevice>
    </PhysicalNetworkDevice>
  </BusConfig>
  <NAT GlobalInterface="virtual20">
    <NATRule>map [GlobalNatInterface] [host:WINDOWS] -&gt; 0/32 portmap tcp/udp 18000:18999</NATRule>
    <NATRule>map [GlobalNatInterface] [host:WINDOWS] -&gt; 0/32 icmpidmap icmp 19000:19999</NATRule>
    <NATRule>rdr [GlobalNatInterface] [addr] port 3389 -&gt; [host:WINDOWS] port 3389 tcp proxy RemoteIP</NATRule>
    <NATRule>rdr [GlobalNatInterface] [addr] port 139 -&gt; [host:WINDOWS] port 139 tcp</NATRule>
    <NATRule>rdr [GlobalNatInterface] [addr] port 445 -&gt; [host:WINDOWS] port 445 tcp/udp</NATRule>
    <NATRule>rdr [GlobalNatInterface] [addr] port 49001 -&gt; [host:WINDOWS] port 49001 tcp</NATRule>
    <NATRule>rdr [GlobalNatInterface] [addr] port 49002 -&gt; [host:WINDOWS] port 49002 tcp</NATRule>
    <NATRule>rdr [GlobalNatInterface] [addr] port 49003 -&gt; [host:WINDOWS] port 49003 tcp</NATRule>
    <NATRule>rdr [GlobalNatInterface] [addr] port 49004 -&gt; [host:WINDOWS] port 49004 tcp</NATRule>
    <NATRule>rdr [GlobalNatInterface] [addr] port 49006 -&gt; [host:WINDOWS] port 49006 tcp</NATRule>
    <NATRule>rdr [GlobalNatInterface] [addr] port 49010 -&gt; [host:WINDOWS] port 49010 tcp</NATRule>
    <NATRule>rdr [GlobalNatInterface] [addr] port 443 -&gt; [host:WINDOWS] port 443 tcp</NATRule>
    <NATRule>rdr [GlobalNatInterface] [addr] port 4840 -&gt; [host:WINDOWS] port 4840 tcp</NATRule>
    <StandardGateway Ip="" />
  </NAT>
</KagaConfig>