<?xml version="1.0" encoding="utf-8" standalone="no" ?><KagaConfig xmlns:xsi="http://www.w3.org/2001/XMLSchema-instance" xsi:noNamespaceSchemaLocation="/Roboter/Config/System/Common/Schemes/KagaConfig.xsd">
  <Version Label="">
    <Info Version="KUKA V8.3"/>
    <Schema Version="400"/>
  </Version>
  <BusConfig Id="NETWORK_CONFIG_KUKA_LINE_INTERFACE" isActive="true">
    <PhysicalNetworkDevice HibernateSupport="true" LinkSettings="Autonegotiation" Priority="12">
      <IfConfig Ip="none" IpConfigType="noIp" Name="gei" Netmask="none" Unit="1"/>
      <VirtualNetworkDevice>
        <IfConfig Ip="192.168.1.32" IpConfigType="IpnetStatic" Name="KLI" Netmask="ffff0000" Unit="5"/>
        <Queue Priority="60" Resources="100">
          <Filter String="Filter2"/>
          <Filter String="Filter0"/>
          <Filter String="Filter1"/>
          <Filter String="EthernetIP"/>
        </Queue>
        <Queue Priority="255" Resources="100">
          <Filter String="Filter2"/>
          <Filter String="AcceptAll"/>
        </Queue>
      </VirtualNetworkDevice>
    </PhysicalNetworkDevice>
  </BusConfig>
  <NAT GlobalInterface="virtual5">
    <NATRule>map [GlobalNatInterface] [host:WINDOWS] -&gt; 0/32 portmap tcp/udp 18000:18999</NATRule>
    <NATRule>map [GlobalNatInterface] [host:WINDOWS] -&gt; 0/32 icmpidmap icmp 19000:19999</NATRule>
    <NATRule>rdr [GlobalNatInterface] [addr] port 3389 -&gt; [host:WINDOWS] port 3389 tcp proxy RemoteIP</NATRule>
    <NATRule>rdr [GlobalNatInterface] [addr] port 139 -&gt; [host:WINDOWS] port 139 tcp</NATRule>
    <NATRule>rdr [GlobalNatInterface] [addr] port 445 -&gt; [host:WINDOWS] port 445 tcp/udp</NATRule>
    <NATRule>rdr [GlobalNatInterface] [addr] port 49001 -&gt; [host:WINDOWS] port 49001 tcp</NATRule>
    <NATRule>rdr [GlobalNatInterface] [addr] port 49002 -&gt; [host:WINDOWS] port 49002 tcp</NATRule>
    <NATRule>rdr [GlobalNatInterface] [addr] port 49003 -&gt; [host:WINDOWS] port 49003 tcp</NATRule>
    <NATRule>rdr [GlobalNatInterface] [addr] port 49004 -&gt; [host:WINDOWS] port 49004 tcp</NATRule>
    <NATRule>rdr [GlobalNatInterface] [addr] port 49006 -&gt; [host:WINDOWS] port 49006 tcp</NATRule>
    <NATRule>rdr [GlobalNatInterface] [addr] port 49010 -&gt; [host:WINDOWS] port 49010 tcp</NATRule>
    <NATRule>rdr [GlobalNatInterface] [addr] port 443 -&gt; [host:WINDOWS] port 443 tcp</NATRule>
    <NATRule>rdr [GlobalNatInterface] [addr] port 50040 -&gt; [host:WINDOWS] port 50040 tcp</NATRule>
    <NATRule>rdr [GlobalNatInterface] [addr] port 4840 -&gt; [host:WINDOWS] port 4840 tcp</NATRule>
    <StandardGateway Ip="192.168.1.32"/>
  </NAT>
  <UserFilter Attribute="8100" Id="Filter0" Type="pkt"/>
  <UserFilter Attribute="8892" Id="Filter1" Type="pkt"/>
  <UserFilter Attribute="3" Id="Filter2" Type="denyVlan"/>
</KagaConfig>